date,published_at,source_id,source_name,author,content,title,url,url_image
2021-08-09,2021-08-09T07:01:44,,Inman,Sotheby's International Realty,"Cryptocurrency has built considerable momentum over the last few years, particularly with the rising value of Bitcoin. Now that its making a foray into the luxury real estate market, heres what you n… [+5297 chars]",Accepting cryptocurrency in homebuying,https://www.inman.com/2021/08/09/accepting-cryptocurrency-in-home-buying/,https://webassets.inman.com/wp-content/uploads/2021/08/Header.jpg
2021-08-09,2021-08-09T05:00:03,,Dailyfintech.com,Ilias Louis Hatzis,"Bitcoin and Ethereum hit their highest value in more than two months, as the market faces uncertainty because of regulations in the United States’ infrastructure plan. Early Sunday morning, bitcoin s… [+4642 chars]",The end of Ethereum mining. What does mean for Ether’s price?,https://dailyfintech.com/2021/08/09/what-does-the-end-of-ethereum-mining-mean-for-its-price/,https://i2.wp.com/dailyfintech.com/wp-content/uploads/2021/08/ethereum-london-hard-fort.png?fit=1000%2C615&ssl=1
2021-08-09,2021-08-09T20:17:22,,Yahoo Entertainment,Reuters,"By Gertrude Chavez-Dreyfuss
NEW YORK, Aug 9 (Reuters) - Bitcoin investment products and funds registered outflows for a fifth consecutive week, as investor sentiment remained cautious in the midst o… [+1998 chars]","Bitcoin, cryptos post 5th straight week of outflows -CoinShares data",https://finance.yahoo.com/news/bitcoin-cryptos-post-5th-straight-201722580.html,https://s.yimg.com/cv/apiv2/social/images/yahoo_default_logo-1200x1200.png
2021-08-09,2021-08-09T08:37:15,,Cointelegraph,Cointelegraph By William Suberg,"Bitcoin (BTC) is delighting bulls as it heads into a new week after closing a weekly candle in which it gained another $4,000 can it hold?
After spending much of the previous seven days hitting but … [+6748 chars]",BTC price caps $4K weekly gains: 5 things to watch in Bitcoin this week,https://cointelegraph.com/news/btc-price-caps-4k-weekly-gains-5-things-to-watch-in-bitcoin-this-week,https://images.cointelegraph.com/images/1200_aHR0cHM6Ly9zMy5jb2ludGVsZWdyYXBoLmNvbS91cGxvYWRzLzIwMjEtMDgvNjZiYzliODMtZWM5ZC00YTFhLTkxOTQtYWNjYzE1Y2U3YjI4LmpwZw==.jpg
2021-08-09,2021-08-09T21:39:41,abc-news-au,ABC News (AU),David Chau,"Australian shares are hovering near record highs and are expected to rise even further in morning trade.
This is despite global markets essentially treading water overnight as sharp falls in gold an… [+1577 chars]",ASX to rise and bitcoin surges as Wall St slips from record highs,https://www.abc.net.au/news/2021-08-10/asx-wall-street-bitcoin-oil-market-reopening-trade/100363636,https://live-production.wcms.abc-cdn.net.au/5bc68c5e39bfb580119450a7e86dfd0b?impolicy=wcms_crop_resize&cropH=585&cropW=1040&xPos=0&yPos=0&width=862&height=485
2021-08-09,2021-08-09T18:03:56,,Bitcoin Magazine,Namcios,"Investment firm Hashdex has announced its newest bitcoin exchange-traded fund (ETF) offering in Brazil, BITH11. The investment vehicle provides bitcoin exposure to retail investors by tracking the Na… [+2076 chars]","Brazil Lists Another Bitcoin ETF, First Carbon-Neutral",https://bitcoinmagazine.com/markets/carbon-neutral-bitcoin-etf-brazil,https://bitcoinmagazine.com/.image/t_share/MTgyMzg4OTgzNTU5NTYyMzcx/tree.jpg
2021-08-09,2021-08-09T23:00:00,,Cointelegraph,Cointelegraph By Jordan Finneseth,"Bitcoin (BTC) price soared to a 3 month high at $46,293 after bulls confirmed that they intend to take full control of the market. While crypto traders might be in the green again and pro traders are… [+3432 chars]",MicroStrategy and Bitcoin mining stocks rally as BTC price rebounds,https://cointelegraph.com/news/microstrategy-and-bitcoin-mining-stocks-rally-as-btc-price-rebounds,https://images.cointelegraph.com/images/1200_aHR0cHM6Ly9zMy5jb2ludGVsZWdyYXBoLmNvbS91cGxvYWRzLzIwMjEtMDgvMjJmNjAxNTgtYmMzMy00MzQyLTljNGUtZWZmNjQwMTA0MjY3LmpwZw==.jpg
2021-08-09,2021-08-09T23:56:01,,Neowin,Paul Hill,Accountants and financial advisors have told CNBC that people who use cryptocurrency-based payment cards could unknowingly be racking up huge tax bills due to the way cryptocurrencies are taxed. When… [+1628 chars],Consumers with crypto-backed debit and credit cards could face hefty tax bills,https://www.neowin.net/news/consumers-with-crypto-backed-debit-and-credit-cards-could-face-hefty-tax-bills/,https://cdn.neow.in/news/images/uploaded/2021/02/1612439701_cryptocurrency_story.jpg
2021-08-09,2021-08-09T20:37:11,,Bitcoin Magazine,Pedro Solimano,"With regards to the article written by former president of the Chilean Central Bank, José De Gregorio, the discussion would not be complete without a response by those who adhere to Bitcoin and the t… [+11088 chars]",What The Former President Of Chile’s Central Bank Gets Wrong About Bitcoin,https://bitcoinmagazine.com/culture/bitcoin-vs-chile-central-bank,https://bitcoinmagazine.com/.image/t_share/MTc5Mjk3ODEzMTkwNDg1Njk5/bitcoiners-build-community-in-chile.jpg
2021-08-09,2021-08-09T22:10:26,,Business Wire,,"CHICAGO--(BUSINESS WIRE)--Vesper Finance, a leading DeFi ecosystem and growth engine for crypto assets, today announced the availability of new Vesper Grow Pools for Uniswap (UNI) and Tether (USDT) t… [+1747 chars]",Vesper Finance Launches Yield-generating Pools for UNI and USDT,https://www.businesswire.com/news/home/20210809005824/en/Vesper-Finance-Launches-Yield-generating-Pools-for-UNI-and-USDT,https://mms.businesswire.com/media/20210809005824/en/897747/23/Vesper-2021-Logo-RGB%402x.jpg
2021-08-09,2021-08-09T11:42:40,,New York Times,Ephrat Livni,"Senators spent a second weekend in a row wrangling over the details of a $1 trillion bipartisan infrastructure proposal, putting off a planned summer break. Were doing it the old-fashioned way, Senat… [+1501 chars]","After wrangling, the infrastructure bill nears the finish line in the Senate.",https://www.nytimes.com/2021/08/09/business/after-wrangling-the-infrastructure-bill-nears-the-finish-line-in-the-senate.html,https://static01.nyt.com/images/2021/08/09/business/09econ-brf-instrastructure/merlin_193072671_36f8f9a4-19e5-497b-abc8-010bd7882cc2-facebookJumbo.jpg
2021-08-09,2021-08-09T13:20:00,,CNBC,Lizzy Gurdus,"Coinbase's earnings report this week could be pivotal for the stock, one trader says.
Though shares of the cryptocurrency trading platform have fallen from their initial public offering price, ""that… [+1962 chars]","Coinbase could jump up to 16% after earnings this week, trader says",https://www.cnbc.com/2021/08/09/buy-disney-coinbase-ahead-of-earnings-this-week-traders-say.html,https://image.cnbcfm.com/api/v1/image/106868180-1618418625322-106868180-1618412398247-106868180-16184113502021-04-14t144147z_1176405212_rc2qvm9lr94l_rtrmadp_0_coinbase-ipo.jpg?v=1618418675
2021-08-09,2021-08-09T20:58:53,,Yahoo Entertainment,Reuters,"By Gertrude Chavez-Dreyfuss
NEW YORK (Reuters) - Bitcoin investment products and funds registered outflows for a fifth consecutive week, as investor sentiment remained cautious in the midst of incre… [+1992 chars]","Bitcoin, cryptos post 5th straight week of outflows -CoinShares data",https://www.yahoo.com/finance/news/bitcoin-cryptos-post-5th-straight-205853823.html,https://s.yimg.com/uu/api/res/1.2/.D7dH6iXm_ROGugQD2uSSw--~B/aD00OTc7dz04MDA7YXBwaWQ9eXRhY2h5b24-/https://media.zenfs.com/en/reuters.com/3152f72877c3f96541fc1ae2958678fa
2021-08-09,2021-08-09T13:00:00,,Yahoo Entertainment,ACCESSWIRE,"NASHVILLE, TN / ACCESSWIRE / August 9, 2021 / EV Biologics Corp, OTC PINK:YECO, today updated shareholders with further details about its NFT Warrant Dividend.
Attached is a preliminary image from t… [+4934 chars]",EV Biologics NFT Dividend Information,https://finance.yahoo.com/news/ev-biologics-nft-dividend-information-130000462.html,https://s.yimg.com/uu/api/res/1.2/QUHEn86yRH7yaTFfA1.teA--~B/aD00MjA7dz00MDA7YXBwaWQ9eXRhY2h5b24-/https://media.zenfs.com/en/accesswire.ca/74e29240562dc23cd8bd1d3ff2e3c590
