date,published_at,source_id,source_name,author,content,title,url,url_image
2021-08-03,2021-08-03T18:30:00,,Cointelegraph,Cointelegraph By Sam Bourgi,"Gelato Network, a protocol that automates smart contract executions on Ethereum (ETH), has integrated with DeFi aggregator Zerion to help users better manage liquidity when interacting with decentral… [+1755 chars]",Smart contract automator Gelato brings liquidity management to Zerion,https://cointelegraph.com/news/smart-contract-automator-gelato-brings-liquidity-management-to-zerion,https://images.cointelegraph.com/images/1200_aHR0cHM6Ly9zMy5jb2ludGVsZWdyYXBoLmNvbS91cGxvYWRzLzIwMjEtMDgvOTlmZDAxYjctMzE4My00NTYzLTgzMDktNDJlYjZmOGM3MjY1LmpwZw==.jpg
2021-08-03,2021-08-03T11:12:54,,Yahoo Entertainment,Nicholas Pongratz,"BeInCrypto 
Securities and Exchange Commission (SEC) Chairman Gary Gensler is looking to establish a robust cryptocurrency regulatory framework.
In an interview with Bloomberg, Gensler emphasized t… [+663 chars]",Gensler Contemplating Robust Crypto Oversight Regime,https://finance.yahoo.com/news/gensler-contemplating-robust-crypto-oversight-111254270.html,https://s.yimg.com/uu/api/res/1.2/72fx8LnGZZSZZ4HG3IL5IQ--~B/aD03MjA7dz0xMjAwO2FwcGlkPXl0YWNoeW9u/https://media.zenfs.com/en/beincrypto_articles_718/d094756ef7aa21ba7b840f454e19dad2
2021-08-03,2021-08-03T15:52:32,,Motley Fool,"newsfeedback@fool.com (Evan Niu, CFA)","What happened
Shares of Nvidia (NASDAQ:NVDA) climbed by as much as 2% on Tuesday morning after a couple of Wall Street analysts raised their price targets on the company. As of 11:15 a.m. EDT, the s… [+1557 chars]",Why Nvidia Shares Climbed Modestly Before Reversing Tuesday Morning,https://www.fool.com/investing/2021/08/03/why-nvidia-shares-climbed-modestly-before-reversin/,https://g.foolcdn.com/editorial/images/636807/geforce-rtx-3070-ti-product-gallery-full-screen-3840-1.jpg
2021-08-03,2021-08-03T16:54:42,,Bitcoin Magazine,Namcios,"Bitcoin mining company Stronghold Digital Mining has reportedly acquired a second coal refuse site in Pennsylvania. The firm also said it was ""currently in negotiations"" to obtain a third facility in… [+1888 chars]","Bitcoin Miner Stronghold Acquires Second Power Plant, Could Double Capacity",https://bitcoinmagazine.com/business/stronghold-acquires-second-power-plant,https://bitcoinmagazine.com/.image/t_share/MTc5Mjk3ODU1MzM1OTAwODY3/russia-aluminum-plant-turns-to-cryptocurrency-mining.png
2021-08-03,2021-08-03T16:10:26,,Bitcoin Magazine,Namcios,"CleanSpark, a software and services company that ventured into bitcoin mining in December 2020, announced some updates on its Bitcoin strategies. The firm also shared insights on its energy mix, clai… [+1723 chars]","CleanSpark Provides Updates On Bitcoin Mining Operations, Outlines Expansion Plans",https://bitcoinmagazine.com/business/cleanspark-bitcoin-july-95-carbon-free,https://bitcoinmagazine.com/.image/t_share/MTc5Mjk3NzYwMzA1MTYxODc5/genesis-mining-files-with-sec-for-bitcoin-mining-fund.jpg
2021-08-03,2021-08-03T09:03:03,rt,RT,RT,"Ben Swann and Christy Ai explain what this infrastructure bill has to do with cryptocurrencies and how it will affect the crypto market.
For more stories on economy &amp; finance visit RT's business… [+7 chars]",RT’s Boom Bust looks into US government plan to tax crypto to pay for massive spending program,https://www.rt.com/business/530966-boom-bust-us-crypto-tax/,https://cdni.rt.com/files/2021.08/article/6109034d20302709ec7056e4.JPG
2021-08-03,2021-08-03T20:30:00,,Cointelegraph,Cointelegraph By Benjamin Pirus,"Ethereums London upgrade is set to activate on Thursday, according to the countdown available on Ethereum.org. The London upgrade is scheduled to go live on Ethereum in August 2021, on block 12,965,0… [+1629 chars]","Ethereum’s London hard fork expected to arrive on Thursday, ushering in EIP-1559",https://cointelegraph.com/news/ethereum-s-london-hard-fork-expected-to-arrive-on-thursday-ushering-in-eip-1559,https://images.cointelegraph.com/images/1200_aHR0cHM6Ly9zMy5jb2ludGVsZWdyYXBoLmNvbS91cGxvYWRzLzIwMjEtMDgvODI2YmViOTItNzNmNy00ZDAxLTliYzktZGVkODE1N2I2MDk3LmpwZw==.jpg
2021-08-03,2021-08-03T09:22:35,the-times-of-india,The Times of India,Reuters,"The Ethereum platform's potential applications, lower environmental impact and technical upgrades are likely to help the ether token continue to outperform bitcoin, Pantera Capital CEO Dan Morehead s… [+1898 chars]","Upgrades, ESG, DeFi usage to help ether outpace bitcoin: Pantera Capital",https://economictimes.indiatimes.com/markets/cryptocurrency/upgrades-esg-defi-usage-to-help-ether-outpace-bitcoin-pantera-capital/articleshow/85001950.cms,"https://img.etimg.com/thumb/msid-85001980,width-1070,height-580,imgsize-65006,overlay-etmarkets/photo.jpg"
2021-08-03,2021-08-03T13:39:23,,Business Wire,,"ALPHARETTA, Ga.--(BUSINESS WIRE)--Bakkt Holdings, LLC (Bakkt), the digital asset marketplace behind the Bakkt App, announced a partnership with Quiznos, a national quick service restaurant (QSR), to … [+4179 chars]",Bakkt Partners with Quiznos Restaurants to launch Pay with Bitcoin Pilot In-Store,https://www.businesswire.com/news/home/20210803005381/en/Bakkt-Partners-with-Quiznos-Restaurants-to-launch-Pay-with-Bitcoin-Pilot-In-Store,https://mms.businesswire.com/media/20210803005381/en/895827/23/Lockup_Bakkt_Quiznos_01_RBG_k%404x_%28002%29.jpg
2021-08-03,2021-08-03T05:08:22,,newsBTC,Aayush Jindal,"Ethereum remained well bid above the $2,500 zone against the US Dollar. ETH price must stay above $2,400 for upside continuation in the near term.
<ul><li>Ethereum struggled to clear the $2,650 resi… [+2067 chars]","TA: Why Ethereum (ETH) Remains Attractive On Dips Towards $2,400",https://www.newsbtc.com/news/ethereum/ethereum-attractive-on-dips-2400/,https://www.newsbtc.com/wp-content/uploads/2021/05/shutterstock_1402375832.jpg
2021-08-03,2021-08-03T12:44:00,,Yahoo Entertainment,PR Newswire,"PHILADELPHIA, Aug. 3, 2021 /PRNewswire/ -- Impervious Inc. today announced the public launch of .forever domains -- the world's first truly decentralized domain names that individuals can own forever… [+2646 chars]",Impervious Launches World's First Truly Decentralized Domain Names Without Renewal Fees,https://finance.yahoo.com/news/impervious-launches-worlds-first-truly-124400251.html,https://s.yimg.com/uu/api/res/1.2/7FkcY_VymWukg7txye2RVg--~B/aD0xNjt3PTE2O2FwcGlkPXl0YWNoeW9u/https://media.zenfs.com/en/prnewswire.com/5cc8db6578f0d5e1e5b74dfdc443efee
2021-08-03,2021-08-03T19:06:34,,Forbes,"Frank Holmes, Contributor, 
 Frank Holmes, Contributor
 https://www.forbes.com/sites/greatspeculations/people/frankholmes/","August 2, 2021
Welcome to the Metaverse
U.S. Global Investors
You may not be familiar with the term metaverse, but if youve been a consumer of popular books, movies and video games over the past 3… [+8421 chars]",The Metaverse: What Every Early-Stage Investor Needs To Know,https://www.forbes.com/sites/greatspeculations/2021/08/03/the-metaverse-what-every-early-stage-investor-needs-to-know/,https://thumbor.forbes.com/thumbor/fit-in/1200x0/filters%3Aformat%28jpg%29/https%3A%2F%2Fspecials-images.forbesimg.com%2Fimageserve%2F6109926895327e3d03194ad4%2F0x0.jpg
2021-08-03,2021-08-03T15:21:31,business-insider,Business Insider,Isabelle Lee,"China is increasingly cracking down on bitcoin.
Florence Lo/Illustration/Reuters
Chinese cryptocurrency addresses sent $2.2 billion worth of digital assets to addresses associated with illicit acti… [+2200 chars]","Chinese crypto addresses have sent over $2 billion to scammers in the last 2 years, report says",https://markets.businessinsider.com/news/currencies/chinese-cryptocurrency-address-scammers-bitcoin-chainalysis-china-btc-2021-8,https://images2.markets.businessinsider.com/60d0679d3093db00197022ce?format=jpeg
2021-08-03,2021-08-03T13:32:54,,Forbes,"Sean Stein Smith, Contributor, 
 Sean Stein Smith, Contributor
 https://www.forbes.com/sites/seansteinsmith/","Rushing through crypto regulation will cause more harm than good, but having more substantive conversations is a good start. 
Getty
getty
Current proposed language in the infrastructure bill worki… [+5435 chars]","Crypto Regulation Needs Clarity, But Rushing It Is A Bad Idea",https://www.forbes.com/sites/seansteinsmith/2021/08/03/crypto-regulation-needs-clarity-but-rushing-it-is-a-bad-idea/,https://thumbor.forbes.com/thumbor/fit-in/1200x0/filters%3Aformat%28jpg%29/https%3A%2F%2Fspecials-images.forbesimg.com%2Fimageserve%2F61094285eb5617316f3a3186%2F0x0.jpg
2021-08-03,2021-08-03T17:29:28,,Cointelegraph,Cointelegraph By Jon Rice,"On Friday of last week, I got a press release from Grace at a music and public relations firm called 23, and Grace wanted to know if I was interested in running a feature on a series of nonfungible t… [+8114 chars]","Thanks to Bauhaus, I totally get NFTs now",https://cointelegraph.com/news/thanks-to-bauhaus-i-totally-get-nfts-now,https://images.cointelegraph.com/images/1200_aHR0cHM6Ly9zMy5jb2ludGVsZWdyYXBoLmNvbS91cGxvYWRzLzIwMjEtMDgvZjhmMGEwNDItNDJjNy00YWFhLWI1NTctOTNmMzdlNjc4YjM2LmpwZw==.jpg
2021-08-03,2021-08-03T17:38:45,,Yahoo Entertainment,Georgina Tzanetos,"eclipse_images / Getty Images
Individual retirement account provider Choice and Bitcoin mining/hosting firm Compass Mining recently announced that they are offering an IRA that would allow miners to… [+2278 chars]",New IRA Allows for Tax-Deferred Bitcoin Mining,https://finance.yahoo.com/news/ira-allows-tax-deferred-bitcoin-173845493.html,https://s.yimg.com/uu/api/res/1.2/LJHZrvRYQdCrsJUVy3D86Q--~B/aD0xMDgwO3c9MTkyMDthcHBpZD15dGFjaHlvbg--/https://media.zenfs.com/en/gobankingrates_644/b3c7b4580d4a6b1ffd87256c0d78e9db
